Unnamed: 0,口コミ,投稿日
1812,平日の宿泊だったからか、客は私たちだけでした。クチコミどおり、たいへんいいお宿だったと思います。和室で、布団敷きはセルフでしたが、それもまた気楽でいいものだと再認識。お風呂は小さめですが、客室も少ないので、貸切状態でなくてもそれほど密にはならないでしょう。お料理も質・量ともに充分満足できるものでした。掃除も行き届いており、残念なのは露天風呂がないことだけでした。,2022/6/24
1813,50歳代、2度目の宿泊です。今回は３０１号室３階の３方向に、窓のある開放的なお部屋にご案内頂きました。北側には、新緑眩しい山が遠くに望め、又、南側は、強羅の駅舎から早雲山方面のロープウエイも望め、とても景色の素晴らしいお部屋でした。夕飯、朝ごはんもバランスよく、美しく､美味しく、量も丁度よく美味しく頂きました。お風呂も他の方と一緒になることなく、窓外のアルコーブから漏れる日差しを感じながら、ゆっくり入る事が出来ました。スタッフの皆様も、親切に接してくださり、施設のお名前とおりだと感じました。また、訪れたくなるお宿ですね。スタッフの皆様、有難うございました。,2022/5/30
1814,箱根観光の前夜に泊まりましたが、強羅駅に近く移動にも便利です。こじんまりとした宿で密になることもなく　感染対策もきちんとしてくれており安心してゆっくり出来ました。温泉はとても熱くお水を入れながら入りましたが、ほぼ貸し切り状態だったので気がね無く入れました。3回入りました。息子はロビーの無料のマッサージ機でお風呂上がりにくつろいでました。何より　夕食も朝食も美味しかった。品数も多くて大満足でした。お世話になりました。,2022/5/10
1815,車で行ったのですが、周りの道が細く、ちょっと分かりづらかった。旅館自体はきれいな印象。部屋は広く和室のいい匂い。食事は美味しい。但し量が多く食べきれない（笑）お風呂は一つだけですがコロナ化の人数制限で混まないように配慮。コロナで中々遠出できなかったですが、久しぶりにのんびりできました,2022/5/3
1816,昨年の秋に夫婦で宿泊して良かったので、今回は足の不自由な高齢の義母を連れて行きましたが本当にいい宿でした。事前に義母の事は知らせていなかったのですが、チェックインの際に足が不自由な事に気付かれて、お風呂に高椅子を用意しますか？車椅子を使われますか？と気持ちの良い対応でした。和洋室の部屋は３人でも広過ぎるくらいです。お風呂は露天風呂は無しですが、ガラス張りで明るく熱めの温泉に水を入れながら宿泊中は貸し切り状態で堪能しました。食事は夕・朝とも和洋折衷で品数も多く夕食のビーフシチュー、朝食の金目鯛の干物に義母は大喜びでした。接客も丁度良い気配り加減で今回も本当にゆっくり出来ました。,2022/4/11
1817,源泉かけ流し＋部屋が綺麗・清潔＋強羅駅から徒歩5分圏内＋低価格箱根の宿の中でもこれだけ条件の良いホテルはないと思います。大浴場についても最大でも4名までと、コロナ対策も万全。私は、入浴中誰も入ってこなかったので実質貸切状態で利用させていただきました。景観も良く、接客も良かったので次回箱根に訪れた際にも利用させていただきます。,2022/2/13
1818,年末の家族旅行で利用しました。小さなお宿なので館内で人と一緒になることもなく落ち着いて静かに過ごすことが出来ました。今回一番良かったのはお食事で、量や種類美味しさはもちろんのこと器や盛り付けが素敵で非日常感を味わえました。,2022/1/15
1820,箱根登山鉄道の強羅駅から徒歩５分以内と近くてアクセス良く駐車場もあります。クリスマスと年末の超繁忙時期の狭間にお安いプランがありましたので訪問しました。落ち着いた瀟洒な建物と清楚な内装で好感が持てます。食事なしプランでしたので、外で食事しました。強羅駅近辺は徒歩圏で食事できるところが少ないので、飛び込みで行くよりもあらかじめ予約を取っておく方が安心です。客室が少なめですので、温泉に２回入りましたが貸し切り状態でした。源泉かけ流しの単純泉で少し肌がぬるぬるするお湯でした。尚、時節柄コロナ対策はきちんと実施されていると思いました。,2021/12/29
1821,隣の部屋の音､気にならない快適｡ 大浴場は広くありませんが､ちょうどよい快適｡駅近3分ぐらいと快適｡近場に食べるところも有り､ここを起点に観光する方には良いのでは！,2021/12/6
1822,70代初めの夫婦です。評判が良かったので初めて利用してみました。場所が分かりにくくて，駅員さんに訊いたり，ホテルに電話したりして辿り着いたら，駅のすぐ近くでした。でも周りは静かでした。和室ですが天井の中央が高くなっているデザインで広く感じられ，畳も床も設備もとてもきれいで，気持ちよく過ごせました。トイレが一段上がっているので私達高齢者には要注意です（バス付きなので高くなっているのでしょう）。窓からの眺めが素晴らしく，座り心地の良いチェアでゆっくりできました。食事はバラエティに富むメニューでとても美味しく，量も十分でした。お風呂も十分広くて湯質も良かったです（白濁ではなく透明）。露天風呂がなくてちょっと残念でしたが，広いガラス窓から庭が見えるので気分的には露天かな。作務衣と足袋ソックスなど色んな点で工夫され，少人数のスタッフで精一杯のおもてなしをしていただいたと感じました。,2021/12/1
1823,食事について、朝食は質・量ともとても良かったです。夕食はもう少し肉料理のボリュームがほしいかなと思います。温泉は清潔感があり温まりますが、好みですが白濁したお湯や硫黄成分が好みですと、こちらはサラッとした温泉です。お部屋にお湯のポットが無かったりしましたが、フロントの対応は良かったです。,2021/11/29
1824,登山帰りに宿泊しました。温泉は、熱めでしたがとても気持ちよく疲れがとれました。ロビーに無料のマッサージ機があり、利用させてもらいました。食事も品数が沢山あり、とても美味しくいただきました。朝の干物も美味しかったです。浴衣が苦手なので、作務衣で過ごせて楽でした。また近くへ来た時は宿泊したいと思います。,2021/11/25
1825,混雑を避けて宿泊部屋の少ないホテルをネットで検索、クチコミ評価されていたmy強羅を選んで大正解でした。特筆すべきは料理の品数の豊富さです。夕食も朝食も大満足でした。高齢夫婦と娘もそのおいしさに舌鼓を打ちました。感染対策もしっかりとされていて安心感がありました。次回は春の季節にまた宿泊したいと思います。,2021/11/25
1826,朝食だけでしたが、和洋両方が出てくる豪華な朝食でした！夕食付にしなかったことが悔やまれるくらいです。お風呂はそれほど熱くはなかったです。人数制限しているのもあるでしょうが、他のお客さんと一緒になることもなく、ゆっくり浸かっていられました。強羅駅からすぐのところにあるので、車より電車で行く人におすすめです。ホテルの中にきちんとした売店はないので、お土産等は強羅駅近くのお店で買うと良いと思います。が、午後5時には大半の店が閉まってしまうので、時間にはお気をつけを。,2021/11/22
1827,駅周辺にコロナ渦の影響か、殆ど食事ができるところが無い食事をするなら、宿か箱根湯本駅周辺で食べたほうが良いかもしれないお風呂は柔らかいお湯で良かったです。お風呂に入るときに、わざわざ入口から遠くで脱いで置いておいたのに、風呂からあがったら間違えて履かれてしまったようだった。部屋は広く、朝食もおいしかったです。,2021/10/30
1828,源泉掛け流しの温泉に入りたくて、口コミを見て予約しました温泉は熱めでしたが、慣れれば大丈夫お肌ツルツルになり大満足ですお風呂へ行く用の籠も便利でした浴衣でなく作務衣よのうな部屋着も良かったですお部屋は和室で、清潔、居心地良かったです窓から美しい山が見え、とても癒されました食事は、和食を頂きましたステキな器に盛られ、目にも美味しくお味も良かったです布団がマルハチの至福の眠りというもので、ぐっすり眠れましたひとつ、要望としては、お料理のお品書きがあれば、なお良かったです美味しいけど、これ、なにかな？と言いながら頂いてました強羅駅にも近く、駐車場もあり便利でした夫とまた行きたいねと話してます,2021/7/24
1829,今回初めて利用させていただきました！全体的に清潔感があり、接客してくれた方たちも感じの良い印象をうけました。部屋が広く、アメニティや細やかな場所まで気配りを感じることができるホテルでした。また温泉が源泉かけ流しということもあり大変満足しました。また利用させて頂きたいとおもいます。,2021/7/24
1830,箱根強羅温泉では非常に珍しい『源泉かけ流し』の宿とのことで、それだけでも価値が高い。部屋数も少ないため、混み合うこともなく、貸切状態でとてもゆったりと過ごすことができた。次は連泊して箱根観光の拠点としてリピートしたい。,2021/6/17
1831,とても清潔感のあるお宿です。露天風呂はなく、こじんまりしたお風呂ですが源泉かけ流しでゆったりできます。食事も美味しく量的にも大変満足しました。娯楽施設はありませんが、ゆったりのんびりするには最適の宿です。またお伺いしたいと思います。,2021/5/5
1832,素泊まりで伺いました。10畳の和室は、とても綺麗でした。大浴場のお風呂は熱いのですが、気持ちいい熱さ。いいお湯でした。感染対策のために、4名まで、外にあるスリッパを見て、4人になるように入りました。一度部屋に戻ったけど、しばらくして入れました。とにかく駅からちかい。電車利用の場合は、便利です。,2021/3/31
1833,いつもの部屋で、いつもの湯に浸かり、いつもの旨い会食を頂戴出来ました！  兎に角、私にとって箱根は近くてのんびり過せます。箱根の湯は好きです。,2021/1/15
1834,何度か利用しています。温泉の質が良いのと、部屋数も多くなく、ゆっくりくつろげるのが気に入っています。コロナ禍で、衛生面は、しっかり対応されており、清潔感は以前と変わることがなかったので、安心して泊まれました。食事も沢山出て、満腹でした。,2021/1/4
1835,お風呂カゴ、館内着、靴下　とても使い勝手がよく感動。コロナのための洗面所のコップも、カラフルで可愛かった。夜、窓から見えるツリーのイルミネーションも素敵でした。そして強羅もち、美味でした。,2020/12/30
1836,今回はコロナ下で自粛を続けて来てやっと東京もgotoトラベルに参加できたので、箱根に来てみました。交通手段を車にしてできるだけ寄り道せずにホテルへ向かいました。ホテルはバイキングでなく部屋数の少ないホテルを選びました。ホテルは部屋が広く清潔で満足しました。食事は部屋が8室にもかかわらず、4組のみでした。他の部屋の方は食事なしの素泊まりになっていました。お風呂も4名以内の利用に制限されていたので安心して入ることができました。夕食は食事内容も食べきれないほどの品数で満足しました。朝食は和洋が中途半端でしたが、量は多く満足しました。コロナ対策が万全で安心して宿泊できました。,2020/11/29
1837,電車利用のため、電車、ケーブルカー、バスのいずれにも交通の便が良い強羅で２泊しました。駅からは２分ほどで、とても楽でした。３階の和洋室は驚くほど広く、３方に窓があり、窓からの山の眺めがきれいで落ち着けました。ベッドは柔らかすぎず、寝心地が良かったです。とにかく食事がおいしく、お肉も魚も野菜も質にこだわっていました。多品種のおかずがそれぞれとても丁寧に調理されていて、見た目もきれいで量もたくさんありました。ご飯は土鍋で昆布を入れて炊いてくださり、本当においしかったですし、お吸い物、赤味噌、白味噌と毎回違うタイプのおつゆも嬉しかったです。和食がメインですが、洋食も少しついていました。温泉も露天ではないものの掛け流しで、窓から小庭が見え、朝晩楽しませていただきました。宿の方は皆さま笑顔で接してくださり、久しぶりに出かけた旅行でしたが、やはり旅行は楽しいものだと実感しました。こじんまりした宿ならではの落ち着きがお好きな方にはとても良いと思います。,2020/11/11
1838,今までに何回か利用させてもらってますが、今回久々の家族旅行でお世話になりました。チェックイン時に杖をついて歩く父の姿を見て、女将さんから「車椅子を用意しましょうか」「お風呂に介護用椅子を設置しておきましょうか」等声をかけて頂いた時は嬉しかったです。館内はエレベータ完備で食堂に行く時や、部屋全体(ツイン利用)もバリアフリーになっており、夜中トイレに行く時や、お風呂も手摺がありましたので安心して過ごす事が出来ました。食事は全て美味しく、特に夕食は季節感感じる品々で男性でも満足できる量です。安心して過ごせる館内、気配りの利く女将さんも居るので父も元気をもらえて嬉しかったです！是非また利用させて頂きます。ありがとうございました。,2020/10/26
1840,３階の和洋室を利用しました。３方の景色が見えるので、当日は雨でしたが窓からの緑が優しくて、和みました。メインは夕食です。刺身、鍋物、茶碗蒸し、種々の和食の料理があり、色々な味覚を楽しめました。コロナ対策で浴場は４名迄の制限でした。しかし朝晩の２回入りましたが、待たずに入れました。又、リピートしたいと思います。,2020/10/19
1841,部屋数が少なく、にごり湯、和洋室、食事が好評だけどハイクラスではない宿を探していたらこちらがあったので行ってみました。風呂は露天風呂が無いのが残念だが個人的にはとても良い湯でした。和洋室の部屋は２人では広すぎました。夕食は品数が多く美味しくて本当に満腹になりました。常時フロントに人がいないので、多少気になる点はありましたが少ない人数でも皆さん笑顔で感じの良い対応が良かった。今回はGoToトラベルでかなり安く利用出来たので満足です。,2020/10/12
1843,口コミ評価が異様に高く、やはり点数との相違はありました。全てが普通でした。もちろん悪くはないのですが、帰るまでに何か点数程のことがあるのかと思いきや、特別なこともなく終わりました。きっと、常連さんがたくさん書き込んでくださったのでしょうか〜けど、そういうお客様をもつこともこの宿のメリットなんでしょう。,2020/2/10
1844,ホテルまでの道が狭く大きな車は大変布団はセルフでしたが朝夕食事は美味しかったお風呂は源泉かけ流しで良かった,2020/1/6
1845,お盆近くの連休に宿泊しました。お宿は駅ちかで、部屋は綺麗、大文字も綺麗に見えました。料理も品数も多くてとても美味しかったです。朝食にカレーがあったのは、嬉しかったです。お風呂は内風呂だけで、ちょっと小さいのが残念でしたが、掛け流しの温泉はとても気持ち良かったです。部屋着の作務衣も着心地が良かったです。また機会があればぜひ泊まりたいです！,2019/10/5
1846,強羅の雰囲気が好きです。部屋もきれいで家族全員が満足度100%でした。子どもたちは卓球にはまってました。,2019/9/27
1847,強羅駅から程近く、箱根旅行の拠点に最高の立地条件にあります。部屋は広く清潔感があり、タオル類を入れて持ち歩ける籠はとても気に入りました。宿全体の広さに比べ部屋数は多くないので、静かにゆったりとした時間を過ごすことができます。温泉は熱めの良いお湯です。食事は器のこだわりも感じられ、ひとつひとつ丁寧に作られてることがわかります。箱根旅行の際は間違いなく、また利用すると思います。,2019/9/26
1848,コスパが凄く良いと感じるお宿でした。食事ももりもり、卓球も楽しめました。またお世話になろうと思います。,2019/9/23
1849,感じの良い女性の方のお迎えで館内に入りました。お部屋は広くて、清潔でした、御飯も美味しく頂きました。強羅からすぐそばでしたし、この時期のコストパフォーマンスはとてもよかったです。,2019/8/17
1850,チェックイン予定時刻を大幅に過ぎて、夕食時刻を一時間半も過ぎてしまったにも係わらず、温かい食事を提供頂きまして大変感動しました。朝食も含め食事レベルも高く、大満足でした。スタッフの皆さんも感じがよくて安心して泊まれました。本当にありがとうございました。部屋も大部屋で孫が大喜び。風呂も清潔で、久々に感動したホテルでした。機会がありましたらまた寄ります。,2019/8/13
1851,夏休みの家族旅行で利用。温泉は源泉でとても気持ちよかったです。施設はとても清潔感、部屋も広々として、食事も満足です。強羅のアクセス良い立地、サービスも満足です。また、泊まりたいです。,2019/8/5
1852,　北海道から一度は箱根に夫と一緒にと3年ほど前の11月紅葉を楽しみにしていた当日、雪で断念！　今回、数日前火山の警戒レベルが上がり又かとホテルに連絡したら、親切に状況をお知らせいただき、安心して伺うことが出来ました。強羅の駅近く、膝の悪い私には有難く、閑静な佇まい、お部屋も和洋室、広く大きな窓から奥深い箱根を堪能。評判通り、夕食一品、一品におもてなしの心が感じられ本当に大満足、朝もこんなに食べられるかなと思うくらいでしたがペロリとたいらげてしまいました。　今度は孫や子供も一緒にと来たいと思います。,2019/5/28
1853,4年前、まだ息子がお腹の中にいた時に夫婦で利用し、お部屋、お風呂はもちろんのこと、お料理の美味しさと接客に感動したので今回は息子も連れて再訪しました。朝夕の食事は普段では食べきれない量ですが美味しいのと子供に分けたりしてほぼ完食しました。子供用に別メニューを用意して頂けたので助かりました。浴場はそんなに広くはないですが、私以外に子連れの他家族も入浴していましたが適度な距離感が保たれる感じで全く気になりませんでした。脱衣所は清潔感がありました。今回G.W.で料金はお高めでしたがそれでも泊まって良かったです。また必ず再訪したいと思います。ありがとうございました。,2019/5/21
1854,計8室のこじんまりとしたホテル。大浴場も小さめですが、大人数のツアー客がおらず、マナーの良いお客さまばかりで、静かで穏やかな時間を過ごせました。建物もまだ新しく、しっかりした造りのようで、隣室や廊下の音が気になるというような事も一切なし。共有スペースも客室もお風呂も食堂も、掃除が行き届いており、アロマ装置や空気清浄機なども設置されていて快適でした。とくにお料理は、一つひとつ丁寧に作られていて期待以上に美味しかったです。フロントで呼び出し電話をかけても少し時間がかかるような場面もありましたが、少人数のスタッフが忙しく飛び回っておられる様子で嫌な感じはしませんでした。また、忙しそうなのに、食事の配膳の時には、テーブル毎でお客さまに「どちらからお見えですか」「お写真を撮りましょうか」「お味はいかがでしょうか」というように声がけをされるなど、気配りも感じられました。食堂にいらした他のお客さまも、「美味しいね」と言いながら、ニコニコ機嫌良くなさっている方が多かった印象があります。細かい事を言うと、テーブルに着くと汁ものとごはん以外はテーブルに揃っているので、コンロで温めている料理は別として、焼き物や煮物などが若干冷たいといった事がありました。しかし、フルコース形式で一つひとつ順番に配膳というのにこだわるなら、もう少し料金のランクアップが必要かなと…。この価格と人手を考えると、本当に最善を尽くされているのではないかと思います。温泉も少し熱めのかけ流しのお湯がとても気持ちよく、リフレッシュできました。また、客室からは、箱根の山々が眺められ、うぐいすのさえずりも聞こえて本当に癒されました。お布団を敷いてもらったり、何度もスタッフを呼び出して、色んなリクエストをなさるような方には向いていないかもしれませんが、私はあまり構われすぎるのが煩わしいので丁度良い感じでした。今回は関西に住む古くからの友人との一泊旅行でしたが「良いホテルを選んでくれてありがとう。このホテルで良かった」と友人にも満足してもらえて良かったです。また、泊まりに行きたいなと思えるホテルです。また、GWで価格は全国的にお高めの時季でしたが、この時季の価格としては良心的な方かと思いました。,2019/5/7
1855,母娘旅で利用させていただきました。小さなお宿なのでこじんまりとしてますが大げさなサービスが無い分気兼ねなく過ごせます。ホテルの方もいつも自然に心遣いのある言葉をかけてくださり気持ち良く過ごせます。朝食時も、母の身体具合の関係で食べるスピードが誰よりも遅い私達は、他のお客さん全員が食事を終えてお部屋に戻っても食事を続けていたのですが、その間食べ終わったお客様のテーブルをこれ見よがしに片付けることもなく、又私達が食べ終わるのを見張るわけでもなかったので、ゆっくりと落ち着いて美味しい朝食をいただけました。朝食そのものもボリューミーでバランスも良く大変満足しております。長い朝食の後にご馳走様でしたと声がけをすると「ごゆっくりどうぞ」と気持ちの良い返事が返ってきました。温泉は小さいので人数が多いとゆっくりできませんが、清潔で温泉の質も良く気持ち良かったです。強羅滞在の時は又利用したいです。今度は大食漢の友人と一緒に夕飯付きで泊まってみたいです。,2019/4/8
1856,朝夕のお食事、どれもハズレがなく、彩りバランス良くとてもおいしかったです！！主人も息子もとても満足していました。ありがとうございました。,2019/3/31
