Unnamed: 0,口コミ,投稿日
5156,プチわけありプランということで、今回ホテル佳山水を利用したのですが、景観がよくないとのことで、私たち夫婦にとってはさほど景色は、重視しておりませんので料金が安く温泉に浸かれ美味しいものがいただけて、スタッフの方たちもとても感じがよくお得な旅行でした。,2014/7/6
5157,遠くへ出かける時間が無くて、今回は箱根の強羅温泉へ行く事にしました。少し広めの部屋の窓からの眺めは素晴らしく、大文字焼きが正面に見え、小鳥の囀りが、心を和ませる宿です。食事は、朝も夜も量は少なめですが、一品一品がお洒落な盛り付けで、見た目に楽しい料理です。温泉は、強羅独特の、あのゆで卵の香り、湯温も丁度良く、３度お風呂に入りました。横浜から１時間程度で着く箱根は、ヤッパリ楽チンです。スタッフの皆さんお世話になりました。,2014/7/3
5158,娘と二人での初めての箱根旅行！そして、娘の昇格祝いで佳山水さんを利用させてもらいました。宿前で賑やかにしていたせいかもしれませんが、佳山水さんのお出迎えにはとても嬉しかったです。お風呂は大きくは無かったですが、とてもゆっくり浸かる事が出来て日頃の疲れもとれました。食事も大変美味しくいただくことができましたし、部屋に届いたフルーツとオードブルとワイン…娘はもちろん私まで幸せな気分を味わう事が出来て最高のひと時でした。一つだけ、もし可能ならば、宿の方々は大変かもしれませんが、部屋のテーブルに置かれていた花(ドライフラワー)ですが、ガラスの器に季節の花を浮かべるだけでも幸せを感じられるのでは…と思いました。帰りがけに迷惑をかけてしまいましたが、お世話になりました。次回も泊まりで箱根旅行に行く時はまた泊まりたいとおもいます。長々と失礼しました。,2014/6/27
5160,箱根の美術館に出掛けました。折角箱根に行くなら一泊したいねと安い予算で此方のホテルに行き当たりました。感心したのは①床の掃除の行き届いた清潔さ②決して豪華ではないが工夫された食事③狭いですが掃除の行き届いた白濁の湯でした。安い費用で正直なところ期待していませんでしたが、感激でした。,2014/6/20
5161,大変お世話になりました。バスがあるのに、部屋に整髪料。ドライヤー等がなくて少し不自由しました。部屋数も少なく、静かでゆっくり温泉を楽しむのには最高でした。有難うございました。,2014/6/19
5162,箱根には毎年何度も訪れていますが、この宿は口コミの評価も高く素敵なコメントがたくさんありましたので是非！！にと、今回初めて利用させていただきました。皆様のコメント通り、とても素晴らしい宿でした。お風呂とは別にパウダールームがあり、そこでドライヤーや化粧水など使うことができるのですが、できれば脱衣場をもう少し広くとって、パウダールームを兼ねていただいた方が使いやすいし、またお風呂上りにゆっくりできると思いました。部屋数が１０室以下と、本当に静かで落ち着くことができる大人の宿です。また是非リピートさせていただきたいと思います。,2014/6/19
5163,結婚記念日に、息子からのプレゼントでこの宿を選びました。部屋数も少なく静かな雰囲気で、ゆっくりと温泉を満喫することができました。夕食も朝食もちょうど良い量で、とても美味しくいただきました。ありがとうございました。,2014/6/18
5164,箱根でこの料金で、コストパフォーマンスの良いお宿だと思いました。以前に家族で山田家さんに宿泊したことがありますが、お風呂へ行く時など、階段の上り下りが多く、移動が大変でした。今回はこじんまりした宿で動線がよく、夫婦でゆっくり過ごすことが出来ました。食事もみな美味しく、おすすめの一品が付くプランでしたので、量も丁度良かったです。レストランは狭いながらも、最大限の工夫がなされていると思いましたが、やはり隣のテーブルが近いですね。露天の雰囲気も良く、白濁の湯をゆっくりと楽しむことが出来ましたが、脱衣場は他の客がいると気を遣ってしまうほど狭いのが、唯一残念な点でした。全体的には食事もお風呂も楽しむ事が出来ました。,2014/6/17
5165,両親と利用しました。スタンダードルームで予約していましたが、お部屋が空いているとのことでスーペリアルームにしていただき、広いお部屋でゆっくりできました。窓からは緑がいっぱいで、外輪山が見えてとてもいい景色でした。大文字焼の時期は最高でしょうね。若干ドアが薄いのか廊下の声が聞こえる以外文句なしでした。お風呂も小さめですが、ほぼ貸切で楽しめました。濁り湯の温泉がとても良く、温度もちょうどよく、３回も入りました。泉質の良さに感動！とても温まりました。夕食も手が込んだお料理で、お値段的に期待していなかったのを良い意味で裏切られました。量は少なめですが私達は小食なのでちょうど良かったです。朝食が和食と洋食を選べるのも嬉しかったです。朝食もとても美味しく、バランスが良かったです。洋食では珍しくお魚がでてきたのも嬉しい驚きでした。また次回箱根に行くときも利用したいと思います。,2014/6/15
5166,皆さん丁寧で優しいし、本当に接客が素晴らしいです！料理も美味しくて、お部屋もお手洗いもどこもキレイにしてあって、滞在中とっても気分良く過ごすことができました(^-^)駅までの送迎もあって、アメニティもいろいろあって満足です！お世話になりました。ありがとうございます。,2014/6/15
5167,両親と私たち夫婦２部屋、観光で利用。こじんまりした宿で、母親はゆっくり落ち着けると喜んでくれました。お風呂は、大きくありませんが、硫黄の香りがする源泉かけ流し風呂でよく温まりました。お料理は、手作りでお腹いっぱいになります。書かれているとおり、お水がおいしかったです。平日価格ですが、箱根にこの値段で利用できたのは良かったです。,2014/6/9
5168,母と二人で利用しました。チェックインを18:00で予約していたら、17:30頃連絡がきて、強羅まで迎えにいきますとのこと。歩いて行こうと思っていたけど、すっごく急な坂だったので、とても助かりました。お部屋は全二階建ての１階でした。景色は見えませんが、静かで落ち着きます。ベッドが畳のベッドだったので、寝相の悪い人や、マットが簡単にくっつけることができるので、カップルや、ファミリーにも良いかもしれません。夜中中使用できるお風呂が1階にありお部屋からすぐでしたので、さっと行けて便利でした。同時に４人位しか利用できない位の広さですが、客室が全１０室なのであんまり他の人と重ならない感じでした。そして乳白色の温泉が最高でした！肌がスベスベです。夜中に何度も貸し切り状態の温泉を堪能してきました♪朝の食事はご飯おかわりできるので食べる人は和食がいいかな。食堂が狭いのが気になりました。,2014/6/2
5169,色々な場所のライトがお洒落で、ホテル全て清潔でした。 私達は自然の風が好きなので、クーラーは使わずに網戸で過ごしましたが、野鳥の囀りがとても、心癒やしてくれました。部屋も使いやすく、落ち着きました。テレビを付ける事も無く、静さ。鳥の囀りを楽しみました、食事も美味しく、朝食は和食と洋食にしましたが、朝から豪華で満足しました。 お風呂も3回入りましたが、どなたとも一緒になりませんでした、やはり10部屋の良さでしょうか。 またお世話になりたいです。,2014/6/1
5170,クチコミ評価の高い評判どおりの宿でした。高齢の両親と共に利用させてもらいました。食事もとてもおいしかったですが、男性や若い人だと少し物足りないかもしれませんので、追加を選択するとよいかもしれません。私たちには十分でした。宿から駐車場まで、ほんの僅かの距離ですが急坂で、帰りは駐車場まで足の悪い両親を車に乗せていただきありがとうございました。平日で宿泊客が少ないせいもありますが、建物の構造も良いせいか静かにゆったり過ごせました。ロビーからの眺めも良かったです。また、紅葉の美しい季節に訪れたいと思います。,2014/5/21
5171,旅館の方の接客も親切で、部屋も清潔感あって広々してきれいでした。ご飯もとてもおいしくて、お腹いっぱいになりました。お風呂は小さめだけど、人が少なくてゆっくりはいれました。大満足です！本当にありがとうございました。,2014/5/14
5173,もう何回もお世話になっているので別宅に帰ってきた気分です。こじんまりとしたホテルなので団体さんはいませんので、今回も３回白濁に体を沈めましたが、いつものように貸切状態でした。スマホに手を伸ばし久しぶりに自写真を撮りましたが白い湯と窓の外の緑がうまく調和しgoodでした。初めて朝を洋風にしましたが、いつもの和食にすればよかったかな？歳も歳ですから味噌汁がよかったかなぁと（笑）一つだけ気になったのはお客さんの浴衣が大きく床に付くほどでした。レストランでですが、Sサイズが無かったのかな？それとも大きいのが好みなのかな？妻は利用しなかったのでわかりませんが…。桶の露天は前回は無く、初めてでしたがやや浅めかな？いやいやこれ以上は贅沢ですね。また伺います。,2014/5/8
5174,　お湯が白濁でとろっとしていて、とても良かったです。お湯から出た後は肌がすべすべになりました。私にはお湯の温度が少し高く、内湯は長い時間浸かっていられなかったのが残念です。露天風呂には丁度良かったです。　山田屋さんのお風呂も利用しました。露天風呂は眺望も良く解放感があり、リラックス効果大です。利用した時は小雨で、新緑に染まった山には霧がかかってましたが幻想的で私には美しく感じました。　朝食は和食と洋食を選択でき、洋食を選びました。朝からちゃんとした魚のムニエルが頂けて嬉しくなりました。食事はどれも美味しく、丁度良い量でした。　丁寧な仕事をされてるお宿だと思います。おかげで良い休日を過ごせました。,2014/5/7
5175,近場の温泉でまったりしたいなと思い、手頃な価格で白濁のお湯を楽しめる佳山水を選びました。部屋は平凡ですが料理は品数もあり頑張っていますね。温泉は良かったですね。落ち着きました。価格が高めの箱根ではリーズナブルに温泉を楽しめる数少ない宿だと思います。,2014/5/4
5176,暖炉のあるロビーからの新緑がきれいで、朝は小鳥の声で目がさめました。お風呂も大きくはありませんが、お湯も良くて、清潔で、何度も入ってしまいました。又、行かせて頂きたいと思います。,2014/5/2
5177,清潔感があり、気持ちよく過ごせました。夕食にもう少しだけボリュームが欲しかった。送迎有り難うございました。,2014/5/2
5178,１泊、２人で利用させていただきました。口コミが良いので選んだのですが、期待どおりで、ほんとうに良いホテルでした。ホテルは、全１０室程度の小さいホテルというのもあって、送迎を含めたサービスも行き届いていました。温泉のお湯が良かったのはもちろん、本館の山田屋の旅館の温泉にも入れるプランで、しかもホテルの温泉の入れ替えもあったので、３回、すべて違う温泉に入ることができました。料理も季節感のあるもので、大満足でした。とてもお勧めできるホテルだと思います。,2014/4/30
5179,ちいさなホテルですので、部屋とお風呂が近くて、濁り湯のお風呂に何回も入りました。桜もまだ咲いていて、野鳥の声で目が覚めました。食事もおいしくて、スタッフの対応もとてもよかったです。山田家さんにも送迎していただき、一泊でしたが温泉三昧できました。温泉好きの方が利用されるようで、お風呂ではリピーターの方からいろいろ情報もいただき、楽しい旅になりました。また利用させていただきたいと思います。,2014/4/27
5180,初めてお邪魔させていただきました。お風呂はホントによかったです！また夕食、朝食ともとても美味しくいただきました。スタッフの方もみなさんとても感じよくぜひまた利用したいです。,2014/4/25
5181,夕飯、朝食美味しかったです。夕飯のオプションでつけた伊勢海老ですが。まだまだあんなに食べるところがあるなんて。知らなかったので、食べ方を教えていただけて嬉しかったです。ありがとうございました。お部屋もお掃除が行き届いており、気持ちよく過ごせました。ただ、換気扇が部屋になく、部屋でタバコを吸われると逃げ道がないので、空気清浄機があるといいなぁと思いました。(２階に喫煙所があるからそこで吸ってもらえばいい話なんですが)部屋で喫煙できる宿が夫は好きなもので。お風呂のお陰でお肌がもちもちすべすべになりました。１泊で４回も入ってしまいました。気持ち良かったです。ありがとうございました。,2014/4/24
5182,高齢の母を連れていたので、強羅や早雲山はじめ、その近辺へもこちらの都合で送迎してもらえて大変助かりました。お料理、サービス、掛け流しの温泉はどれも文句なし。また是非、泊まりたいお宿です。,2014/4/24
5183,友人と2人で週末の1泊旅行で利用させて頂きました。チェックイン時間前に荷物だけ預けにいきましたが、快く対応して頂き、チェックインしたときには既に荷物は部屋に運ばれていました。朝夕とも食事の際は、温かいものがあるのでおいしいうちに召し上がってくださいとか、食事のすすみ具合を見計らってお鍋に火を入れてくれたりと、小さな心遣いをたくさん受け、気持ち良く過ごすことができました。部屋数は10部屋で、お風呂も混むことなく、朝利用した露天風呂も、夜利用した内湯も大満足です。部屋がオートロックだといいねと友人が話していましたので、部屋を4点にしてますが、清潔感や過ごしやすさは5点では足りないくらいです。その他は、強羅駅・早雲山駅への送迎があるのも嬉しかったです。箱根旅行の際は、また利用させて頂きたいです。素敵なおもてなしありがとうございました。,2014/4/22
5184,下調べをして行ったので、お風呂がこじんまりしていることなど承知して行きましたが、白濁のいいお湯でした。露天風呂も小さいながらにとても気持ち良かった。何度も入らせていただきました。そしてお料理はとても丁寧に作られ、出来立てを提供して下さるのでとても満足しました。ちょうど桜も満開で季節的にもいい時期でした。宿の周りは温泉街という訳ではないので、ぶらっと散歩出来なかったのが少し寂しかっただけです。,2014/4/21
5185,温泉大好きで色々な所に出かけています。箱根は良く来ていますが強羅に宿泊したことが無かったので今回は口コミがとても良かった佳山水さんに決めました。二泊三日でお世話になりました。とにかく温泉が最高でした。お食事も、接客も大変良かったと思います。ひとりで気ままに毎月色々な場所に出かけていますが、また伺いたいと思っていますお勧めのお宿です。有難うございました。,2014/4/21
5186,にごり湯の温泉は気持ち良く、チェックイン後、夕食後、朝食前と利用させていただきました。毎回湯船は私一人で、のんびり入浴。コンパクトな宿ならではの良さですね。楽しみにしていた夕食は、とっても美味しかったです。白和えが桜色だったり、茶碗蒸しをチーズ焼きにしたりとお洒落な懐石料理で、酒の肴にもぴったり。温泉一人旅なら静かな宿がいいなと思い、この宿に決めました。温泉と食事は勿論、清潔な館内、親切なスタッフの皆様。大当たりでした。箱根に出かける時は、また利用したいです。,2014/4/15
5187,温泉がとても良いです。また、食事、サービスが良いです。ただ、部屋が広さは十分ですが、バス・トイレが狭く段差があったり、できたら改善するとさらに魅力が増すと思います。全体的には、かなり気に入りました。,2014/4/14
5188,春の小雪降る中のお出迎えありがとうございました。気持ちよくチェックインができました。部屋も広く清潔感があり気持ちよかったです。お風呂のにごり湯は気持ちよく何回も入りました。夕食も朝食も温かいものは食事の流れに合わせて出されとても美味しかった。また訪れたい宿です。,2014/4/8
5189,掛け流し温泉と高評価の食事を重視してみつけたのがココでした。温泉は白い濁り湯で、口コミ通りとてもよかったです！1日2回男女交替になるようで両方利用しましたが、内湯のみの方のお湯がかなり熱かった…夕食は彩りきれいな和食を少しずつ楽しめました。量は多くないですが、日中に食べ歩きをした私達には適量でおいしかったです。母の誕生日旅行だったのでサプライズでケーキを注文。料金を聞いたとき割高だと迷いましたが、小さくてもおいしいケーキ(お店を聞けばよかった！)でしたし、食器のチョイスもきちんとしていて好感が持てました。部屋の飲物が冷蔵庫の中の湧き水と粉緑茶のみだったので、部屋の備え付けでティーバッグの紅茶やインスタントコーヒーもほしいところ。結局ルームサービスにてコーヒーを別途注文。気になったところばかり書きましたが、ぜひリピートしたいと母も納得の宿でした。,2014/4/5
5190,リーズナブルなのにそれを感じさせないお宿です！建物自体に趣きがあったりおしゃれだったりという造りではありませんが、部屋はもちろん、脱衣所もパウダールームもトイレも、どこもかしこも清潔な事が何より嬉しかったです。お掃除のお心遣いが隅々まで行き届いていて、気持ちが良かったです☆失礼ながらお値段的に期待していなかったお食事は、見た目も素敵だしびっくりする美味しさ(*^^*)もりもり頂いちゃいました！楽しみにしていた温泉は広さはないものの2回とも貸し切り状態で入れたので全く問題なし！白い濁り湯で、疲れがとれるしお肌もしっとりつやつやに(*^^*)駅近なのでチェックイン前に車を置かせて頂いて電車で散策にも行けました☆スタッフの方も、みなさん親切丁寧で心地よい二日間を過ごせました！こんなに安いんだし…とがっかりする部分が全くなく全てお値段以上です(*^^*)また絶対利用したいです☆,2014/4/3
5191,お風呂が良かったのでまた入りたいと思っています。肌が弱く湯上りに痒くなることもありますが、ここのお湯はそのようなことはなかったです。,2014/3/29
5192,当日は大雪の為、予定していた観光を取りやめ早めのチェックインをお願いしたところ、応じて頂いたのは有難かったのですが、時間までは部屋から出ないでくれとか、感じはよくなかったです。宿泊客は私共２名と男性１名だけでした。基本的にスタッフは５０代位の男性と女性の２名できりもりしていました。女性のお風呂は夜と朝の２回とも女性スタッフの方とかち合いリラックス出来なかったようです。女性客は１人しかいないのに、２回共かち合うのは公私混同している宿としか思えません。泉質はよかったです。食事の量は少なめだと思います。男性のスタッフの方は車の雪の処理をしていただいたり、大変感じが良かっただけに残念です。,2014/3/28
5193,姉と二人で宿泊しました。静かで落ち着きます。お湯もとても良かったです。夕飯も、程よい量で美味しかったです。朝食の時間変更にも気持ちよく対応していただき、ありがとうございました。,2014/3/27
5194,室内の照明は少し暗めなのですが、廊下に一歩出ると落ち着いた照明が点在し休憩場所から見える窓も大きくとってとても心安らかな気持ちになります。壁にかかっている絵画の趣味もすてきでした。ちょうど春の嵐の真っ最中でどこに行ってもすごい雨と風と霧で途方に暮れ、予定の時刻より早く到着したのにもかかわらず、気持ちよく室内に入れてくださって安心しました。ありがとうございました。お食事も熱いものは熱く、冷たいものは冷たくといった心遣いが感じられました。一人旅でゆっくりできたことよかったです。また、心癒しに伺いたいと思います。,2014/3/26
5195,春の三連休の中日に利用させて頂きました。ケーブル強羅駅近くのホテルとどちらかで迷いましたが、静かな佳山水さんにして大正解でした。宿の口コミ情報では、何もない所とあったのですが、早雲山、大涌谷、小涌谷が近くて、その日は車を停めさせて頂いてのんびり徒歩で強羅散策、次の日、大涌谷の駐車場が混む前に朝一番に富士山を見に行き、これまた大正解でした。宿自慢の濁り湯は、思い描いていた以上で、こじんまりとした湯船ですが、大きな窓から朝日がいっぱい差し込み、一人たっぷり堪能しました。お湯も熱めが最高！将来夕食に洋風をアレンジして頂けると好きなワインともあうでしょうか！スタッフの皆様の接遇が良かったです。,2014/3/25
5196,数多くの口コミの前評判通り、食事に関しては『量』『味』共に非常に満足しました。朝食も『和食』『洋食』を選べることもイイですね。僕ら夫婦は二人とも和食にしましたが、洋食の方も美味しそうでした。お風呂は、男湯と女湯の入れ替え制なので、唯一ある露天風呂側のお風呂に入るタイミングによっては、女性に不利な時間設定ですね。（朝湯：朝食前に露天風呂に入れるのは男性）あと、部屋に空気清浄機があるとイイですね。最近のお宿は、大概空気清浄機がありますよね。花粉症やハウスダストアレルギー等々がある人にとっては、特に助かります。※部屋は綺麗でした！それ以外は『満足』できるお宿と思います。,2014/3/17
5198,静かなプチホテルでゆっくりできました。温泉も大きくはありませんがお湯の温度も丁度よく、貸切状態で利用できて満足です。食事も丁度いいくらいの量でおいしかったです。部屋の冷蔵庫の天然水のサービスがよかったです。あと旅館によくあるちょっとしたお菓子が部屋にあるともっと満足できたと思います。,2014/3/7
