Unnamed: 0,口コミ,投稿日
0,客室露天風呂、もう少し湯船が大きければよかったんですけど…部屋も、もう少し広ければいいのにと、思いました。,2023/9/26
1,とても良い滞在になりました。温泉も私にはすごくあっていたようで、とても気持ちよく入れました。夫は温泉で長居できないタイプですが、ゆとりろ庵さんのお湯は気に入ったようで、喜んでいました。いつもより長く入れたとのことです。笑夕食では、色々お気遣いくださって、嬉しかったです。この場を借りて御礼申し上げます。給仕の方にもよくしていただきました。お料理も、野菜がふんだんに使われていて美味しかったです。女子が好きそうなお料理だなと思いました。品数も多くて良かったです。フリードリンクも、自由にとりにいく方式が私には楽でいいなと思いました。足湯では、木々を見ながら、のんびりできました。結構、人気スポットだったようにお見受けします。滞在中は浴衣で過ごせたので、楽ちんでした。色々種類を置いていてくださったので、２種類、着用させていただきました。とても楽しく過ごせました。ありがとうございました。,2023/9/26
2,すごく良かったです！クチコミで悪いものも散見されますが、この価格帯では妥当だと思います！お食事もすごい美味しいです。また、彼女が忘れ物をした際に、施設の方々がすごく親切に対応してくださりました。無事、忘れ物も見つかりありがとうございました！,2023/9/24
4,当日は豪雨と風で、計画していたロープウェイや屋外施設の彫刻の森美術館に行くことが出来ず、早めに宿に行き ロビーで待たせていただきました。ウエルカムドリンクのコーヒーで温まり、ゆったりしたソファーで 5時間の旅の疲れを癒すことができました。宿まで歩いてきたかたはずぶ濡れでした。すると、時間前にチェックインさせていただけたのです。以前利用した温泉旅館は、ロビーに人が溢れているのに頑なに時間までチェックイン出来なかったので、フロントのかたのご配慮に 雨で萎えた心が温かくなりました。お部屋は「日にち限定スペシャルプラン」で6畳間とわかっていたので 、狭いとは思いませんでした。2人には丁度よく、窓の外の緑が美しかったです。夕方には、ウエルカムドリンクにアルコール類も追加され 嬉しかったです。夕食は色々なものが少しずつ出ました。60代の私達には適量でしたが、若いかたは物足りないかもしれません。朝食の方が良かったです。そもそも こちらのお宿はじゃらんさんの「日にち限定キャンペーン」に掲載されていたので利用させていただきました。 充実したウエルカムドリンクや選べる色浴衣、スタッフさんのご挨拶等、お値段以上に満足です。御手洗のタオルがハンドタオルだったのですが、削れる所は削って宿泊費に還元されていると思い、好感が持てました。宿泊費の高い箱根強羅にあって コストパフォーマンスの良いお宿です。残念だったのは 大雨で楽しみにしていた足湯テラスを利用出来なかったこと。でも雨のお陰で 宿でゆっくりでき、悪天候にフロントのかたが機転を利かせてくださりゆっくり休むことができて悪くなかったなぁ、と思います。お心遣い、ありがとうございました。,2023/9/24
5,ご飯がこんにゃくや豆腐、野菜などがメインで物足りなかった。お肉もスーパーの？と思う質だった。お腹はいっぱいになるが美味しくは無いので満足感がない。また、飲み物がQRで頼まなきゃいけないのだが、電波はほとんど無いしwifiも遅いのでかなりストレス。隣の卓の人が直接スタッフに頼めていたので、こちらも、、と思い声をかけたら「QRでお願いします」と言われた。違う対応をされて不快な気分です。QRで効率化したいならwifiをもっといいものにしてください。アルコールの提供も遅かった。お風呂は2つあり、片方がぬるかった。こういう設定なのかな、と思ったけど次の日行ったらすごい熱かった。,2023/9/21
7,今回、彼との記念日に利用させて頂きました(*^^*)宿の雰囲気も凄く良かったしスタッフの方の対応も凄く丁寧でした！朝夕のご飯もめちゃくちゃ美味しかったです！お湯はお肌がスベスベになりました！しいて残念かもな…って思う所は…貸し切り露天を利用してた人にはタオルセットをもう一組貸して頂けたらもっと良かったかなぁ…って思いました。それ以外は本当に最高でした！また行きたい！って思える宿です！2人でまた利用させて頂きます(^-^)ありがとうございました(^^),2023/9/14
9,冷房が壊れていたので、あまりゆっくりできなかった。事前に連絡頂いたが前日の夜で中止しようかと思ったがせっかく休みをとったのので、箱根なので夜は大丈夫かと思ったが暑かったので印象が悪いのかもしれません。夕食は見た目は綺麗だが、味は?です。味つけご飯が臭く食べる気がしなかった。魚の処理が悪いのかも?飲み物をお願いするのにスマホを使うが電波状態が悪く苦労しました。他の方も困っていました。せっかくの食事も落ち着かず考えて頂きたい。ツインの部屋にしたが、台の上にマットが置いてあり下りるのが人苦労でした。露天風呂も有料だし料金的には高めです。,2023/8/21
10,駐車場へ到着すると、送迎の車が待機してくれていました。受付の対応や備品なども館内サービスが行き届いていてとても気持ちよく過ごすことができました。お庭もきれいで箱根らしい情緒が味わえます。ただひとつ残念だったことをあげますと、朝食の品々が、インスタント的な出来合いのお惣菜が細々並んでいて（８種の惣菜とおっしゃっていましたが）綺麗ではありましたが、少々手作り感がないように思えたのが残念でした。夕食はバーニャカウダやカルパッチョなどがとても彩りよく並んで、新鮮なお野菜やお魚が美味しくいただけました。温泉も素晴らしかったのでまた利用したいです。,2023/8/2
11,急に決めた箱根旅行でした。近場で少しでも涼しいところを目指して、こちらに辿り着きました。チェックインを担当していただいた、スタッフさん。笑顔が可愛すぎて、一目惚れでした笑接客もステキすぎて、お仕事中なのに、隙をみてはお話ししてしまいました笑ご飯を担当してくれたスタッフさんのキャラクターが面白すぎて、ついつい朝ごはんの時も探してしまいました笑おかわり、すぐ持って来てくれますよ！！お風呂も貸し切り風呂、おススメです。足湯の雰囲気もすごく良かったです！強羅まで足を伸ばしたら、ぜひぜひ、こちらの宿を利用してみてください！,2023/8/1
12,お部屋の広さも丁度よく、早めに貸し切り風呂に入ってのんびりとできました！周りはセミの大合唱でしたが、夏を感じられて満足です。食事も朝、夜共に美味しかったです！,2023/7/31
13,フロントには24時間のドリンクバー、夕方まではアルコールまであり、そのドリンクを持って足湯を楽しめます。温泉はお肌がツルツルになりました！ただアメニティがもう少し充実してるともっといいかなとは思いました！ご飯は夕食朝食ともにとても美味しく、豪華でした！強羅の中ではお値段も比較的お安く、また行きたいと思えるほどいい宿でした！,2023/7/29
14,のんびりと強羅の休日を楽しめました。温泉が完全な掛け流なので嬉しかったです。フロント近くの部屋でしたので、他の宿泊客とほぼ会わずにいられたのも良かったです。,2023/7/29
15,日頃の疲れをとりたいと思い、一人でふらっと行ける近場を考え、箱根のゆとりろ庵様に泊まらせて頂きました。特に観光目的ではなかったので、宿で過ごす時間を多く持ちましたが、窓から見える景色と聞こえてくる蝉や虫の声に癒されながら、ゆっくりすることができました。温泉の泉質はとても良く、肌もツルツルになり、湯上がりもすっきりしました。お料理は多すぎず、適量でした。個人的には少し味付けが濃いと感じるものもありましたが、素材じたいが良くて美味しかったです。温泉とお料理と立地を考えれば、かなり価格は安いと思いますので、またぜひ利用させて頂きたいです。,2023/7/22
16,良い点　部屋からの木々の景色が良く、季節柄ひぐらしや鳥の声が聞きながら過ごせた（但し網戸が無い為窓を開けると虫が入ってくる）悪い点写真で見るサイズ感と実際のサイズにかなり違いを感じた（個人的感想ですが、部屋の露天風呂の浴槽は一人で足も伸ばせない。貸し切り露天風呂は2人が精一杯で家族連れだと全員一緒には無理かも。大浴場も湯船はあまり広くなく湯温がかなり熱めでした）食事は特選懐石でしたが半分洋風で特にお椀物ではなくブイヤベースにはびっくりしました。食材は新鮮で味も良かったのですが、献立が個人的には？と思いました。飲みものの注文もなかなか来てくれず、懐石を食べるのに少し食事処が騒がしすぎました。,2023/7/18
18,箱根強羅の静かな旅館。足湯がオシャレで飲み放題の生ビールと共に最高の時間でした。お風呂も貸切露天風呂を利用しましたが、清潔でゆっくりできました。,2023/7/15
19,曇り空で心配しながら箱根湯元・彫刻の森美術館を回りました。ホテルの玄関までの雰囲気はよかったです。部屋の清掃が今一つ行き届いていませんでした。風呂場は狭く露天風呂もありません。貸切風呂が有料で利用出来ますが割高に思えます。部屋の窓から見る風景は良い感じでした。,2023/7/12
20,フロント、食事の担当さんの笑顔に癒やされました。お仕事頑張ってお客さんを笑顔で癒やして下さい。また来ます。,2023/7/11
21,家族が日本に遊びにきて一緒に宿泊しましたが、ロビーも広くてゆっくり休憩できました。お部屋からも自然を感じられて良かったです！温泉した後、お肌もサラサラで気持ちよく休めました！,2023/7/5
24,親と泊まりましたウェルカムドリンクはアルコールも飲み放題で、ソフトドリンクは24h飲み放題という初めてのサービスがありましたマッサージチェアも24h使え、テラスには足湯があり最高でした食事も盛り付けがきれいで、よかったです,2023/7/1
25,久々のゆとりろ庵さんでした。リロの中ではリーズナブルでとても良いです。又今ウエルカムドリンク生ビールがあり時間延長になってて非常に良かったです。,2023/7/1
26,今回家族旅行で、日本温泉雰囲気を探したところすごくいい感じの宿泊発見。親切でよかったです！また行きます！,2023/6/30
27,新婚旅行として初めての箱根旅行でしたが大満足でした。最上階の部屋を予約したのですが、家族旅行でまた来たいと思えるくらいの広さと落ち着いた空間でゆっくりと楽しめました。ウェルカムドリンクサービスやマッサージ機、足湯、温泉、食事など料金もリーズナブルながら満足できるサービスが揃っていてよかったです。最寄りの駅の最終時間が早いのと近くにはコンビニなどはなく自然豊かな立地にある旅館なので、スケジュールパツパツな旅行ではなく、ゆっくりのんびりとしたリフレッシュする旅行の際にはおすすめの場所だと思います。,2023/6/29
28,部屋にお風呂ついてるので、子供たち大喜びで、何回も入り遊びました。足湯テラスもあり、線香も置いてあり、子供たちも安心で遊べます。とても親切な感じです。ロビーにある無料ドリンクコーナーはワイン、ビールまでありまして、旦那ガブガブ飲んでました(笑。おかげさまで、とてと楽し旅行でした。ありがとうございました！,2023/6/27
60,緑に囲まれた中、貸し切り風呂で1人のんびりと1時間ゆっくりしながら、部屋でのんびり過ごす事が出来ました。朝ご飯の色々な物を少しづつ頂ける感じは女性には嬉しいバランスで満足出来ました。小さなお子様を連れた宿泊客はお見かけせず、カップルやご夫婦が多い印象で、それも良かったポイントです。,2022/6/13
61,お部屋がとても良かったです。とにかく寛げました♪露天風呂付きのお部屋に宿泊。申し分ない広さとお部屋の露天風呂からは目の前に大文字焼きの山々の眺望が最高です。館内は広々としておりロビーの開放感や到着時のドリンクサービスも癒やされました。到着時、突然の強雨となり散策予定を変更し電話で送迎バスをお願いしました。丁寧な対応をいただいてホッと宿に着けました。スタッフの方のサービスも行き届かれていると感じました。ありがとうございました。静かで心地よい滞在となりました。大浴場も広々としており、ゆったり浸かりました。お風呂は景色も素晴らしい為、お部屋の露天風呂を楽しんで過ごしました。食事に関しても文句なし! 席も宿泊者ごとに配慮されており安心して味わえました。内容は控えめと思っておりましたが、満足の量いただきました。朝食は長方形のお重に様々な小鉢がおかずとなっており楽しめました。朝からおかわりもしっかり、いただいたほど。このコスパで素晴らしいと思います。次回は連泊でお世話になりたいと思います。,2022/6/12
62,他の方の口コミを見て心配だった接客については、私は特に気になりませんでした。チェックアウトギリギリにチェックアウトの時間の変更をお願いした際にも、嫌な顔せず快く変更してくださり、対応いただいた女性も終始笑顔で好感が持てました。利用してみて残念だったところは、大浴場とお部屋のお風呂が想像してたよりも狭かった点です。でも貸切風呂は広かったので、気になる方はそちらを利用するといいと思います。良かったところは、浴衣の柄が豊富で選べるところ、食事が美味しくボリュームがあるところです。浴衣の柄は、何分間も悩みました。全部素敵だったから…。今回、彼の誕生日で記念日プランを利用させてもらいました。用意いただいたケーキがとても可愛くて、彼は写真を何枚も撮って喜んでくれていました。あんなにはしゃいでいる彼は初めて見たので、本当に嬉しかったのだと思います。2人のいい思い出になりました。素敵な時間とおもてなしをありがとうございました(●´ω｀●),2022/6/12
63,まず駐車場から宿の入り口に行くまでに見せてくれる趣のある看板から石階段を上がって行くところが、箱根に来たなーと情緒を感じさせてくれました。入り口に入るとこれまた素敵な飾り付けで素晴らしかったです。スタッフの方も丁寧で穏やかな対応で良かったです。ウェルカムサービスもワインやソフトドリンクやお菓子も頂けて、しかもコーヒーサーバーはいつでも利用可能なのも良いです。温泉は2種類の泉質を楽しめて、早雲山からと大涌谷から引いているようで、2倍楽しめました。湯上がり処の黒豆茶も美味しかったです。その後に館内を歩いていたらなんと無料マッサージチェアーが並んでいるのを見つけて、早速利用しました。しかもマッサージチェアーから見える目の前の景色も自然豊かで、心も体も癒やされまてしまい、いつの間にか居眠りしているほどリラックスできました。朝食は2段の御重に可愛らしい多種多様なおかずが並んでいるので味もさることながら目でも楽しめました。朝食処もしっかりとコロナ対策されており、ついたてもあり、一人泊でも落ち着いて食事できました。次回は家族旅行でも利用したいと思います。,2022/6/11
64,強羅のゆとりろは始めてでした。綺麗で良いです。ウエルカムドリンクもあり、相変わらずリーズナブルで、又お伺いします。,2022/6/11
65,マッサージチェアがとても快適！ですが。。。部屋に戻ると全く電波はつながりませんでした。。。。ロビーはWi-Fiがあるので仕方ないのでロビーでケータイをいじってました。,2022/6/10
66,駅まで送迎があるのは助かります。ウエルカムドリンクということで、スパーリングワインまで飲めたり、コーヒーマシーンがいつでも利用可だったのが良かったです。洋室での宿泊でしたが心地よく過ごせました。TVの接触があまり良くなかったのが（見れましたが）残念な点でした。お風呂は混まずにゆっくり入ることができました。接客も良かったと思います。お世話になりました。,2022/5/27
67,結論。様々なタイプのホテルや旅館に宿泊してきましたが、総じてこんなに終始嫌な気持ちで過ごしたのは初めてでした。隣の部屋や廊下の音、振動まではっきりと伝わります。廊下の音は、足音や会話、自販機のガラガラガッシャーン！といった音、ルームキーの鍵のジャジャラした音がはっきりと聞こえます。両隣の小さい子連れのご家族と男性1人客の電話の音か、何話しているが分かる程の音です。なのでもし部屋が空いていれば移させてもらえるか聞きに行きました。受付スタッフに伺うと、「お待ち下さい」と受付の奥へ行き戻ってくると、「ちょっと確認してきます」と。何を確認？もしかしてお隣さんに確認するの？と思い引き留めました。何を確認するのか、お隣さんに声をかけるのか聞くと、「あ、はい、えっと…確認に行ってきます」と。なのでお隣さんが悪いわけでないですし、迷惑かけようと思ってわけではないので「聞きに行ったら悪い思いさせませんか？子供が仕方ないですし自然な物なので」と伝えでも「確認に…」の一点張り。この引き留めと押し問答を3回ほどしたところで受付スタッフはお隣さんの元へ行きました。それから10分程あのスタッフから、「部屋に不備があるとかではない限り部屋の交換は受け付けなくって…」と言われました。答えが初めからわかっていたなら、どうしてお隣さんにまで迷惑をかけるのですか？終いには、「何かまたありましてらお声がけください」と。その何かとはなんでしょうか…。迷惑行為を受けているという意味で今回相談していません。お隣さんに注意をしに行くましてや子供がいるご家庭に注意に行くっておかしくないですか？相談に行ったのに、私もそのご家族さんも後味悪くなった結果です。以下をそのスタッフへ伝えました。「お子さんは仕方ないですし注意しに行くことでご家族さんは悪い気持ちにはりませんか？私は別に良いですが、部屋交換の対応してないのならそう言ってくれれば良い、出来るなら注意などせず淡々と部屋交換してくれれば良い、もっとスマートに対応するべき」と。スタッフは相変わらずしどろもどろに「あ、すみません…はい、申し訳ありません」と謝る一点張りで私の伝えたい事が伝わってるかは分かりません。音に悩みたくなくて0時近くまでロビーで過ごしていました。休みに行った旅行なのにぐったりと疲れました。,2022/5/25
68,キャリヤー付きのミニトランクを持ち上げて玄関まで運ぶのが面倒、あの階段がなんとかならないものか。駐車場も遠い。料理は朝晩とも予想していたより美味しく楽しめた。同系列の熱海の２施設に泊まっているが、こちらの方が断然美味しい。料理長の差なのか?,2022/5/25
69,玄関にたどり着く上り階段がきつくスーツケースをもってあがるのが難儀しました　貸切風呂は期待外れでした　チエックイン後に車のカギを預けましたがチェックアウト時にフロントから鍵をもらい外にでると宿泊者の車がスタッフも居らず置きっぱなしでした　ありえないと思いました,2022/5/24
70,天候が悪く予定のチェックイン1時間前に到着しましたが、すぐ対応していただき、フロントでウェルカムドリンクを頂いている間に、部屋の準備が完了し、部屋に案内してただきました。夕食は盛り沢山のメニューで、お酒を楽しみながら、接客してくださったスタッフさんからメニューの説明やおすすめのお酒を教えていただき、丁寧な対応に一層美味しく楽しい食事になりました。,2022/5/23
71,夕食も朝食もすごく美味しかったし、マッサージチェアも大浴場も足湯もあり、快適に過ごししました。何よりもスタッフ達のおもてなしがよかったで、皆様の笑顔で癒されました。また行きたいと思います。,2022/5/21
72,直前に予約しましたが、スムーズにチェックイン・有意義な時間を過ごすことができました。お料理のボリュームもあり、とても満足した滞在となりました。,2022/5/16
73,チェックインで待たされてなんのためのQRコードかわからなかった。喫煙室がカビ臭くて酷かったです。貸切風呂も葉っぱや虫をすくう網とかあると良かったです。食事も普通でした。値段に対して‥と思いました。期待してた自分がいけなかったかもしれません。,2022/5/16
