Unnamed: 0,口コミ,投稿日
439,温泉でゆっくりしたいね、とこちらのロングステイのコースでお世話になることにしました。まず到着から美味しいコーヒーと丁寧な説明に期待が高まります。お部屋も綺麗で、山々の眺めもよく、お茶と羊羹を頂きほっこり…選んだ浴衣に着替え、個室の温泉へ。なんとも素敵！そしてウィットに富んだユーモアある立て看板（？）と、素敵な温泉で身も心も温かくなりました。夕食の配膳も、ハプニングがあったもののそれを越える丁寧な接客をしていただき大変おいしかったです。よく食べる彼も最後のスイーツ盛り合わせでは、やや苦しそうでした（笑）お見送りまでバスで丁寧にして頂き終始素敵なおもてなしを頂いたのですが、一つだけ残念だったのが朝食のとき、無料でおうどんのサービスがあるとのことで頂きにテクテク歩いて行ったら、サーバーの方が私たち客のことで大っぴらに文句を言われていて残念に思いました…。,2015/10/23
440,リピーターです。今回のお部屋ですが、景色はすごくヨカッタのですが、部屋が汚れていました。隅々にホコリが溜まっていていました。もう少し掃除を丁寧にされたほうがいいかと思いました。お風呂はいつも満足がいくものです。また利用したいと思います。,2015/10/16
441,　傘寿の記念に利用しました。庵は緑に囲まれ落ち着いたステキな雰囲気。　車椅子の妻は女性スタッフの優しい心遣いに感激。昇降設備を操作してもらい貸切露天風呂へ。年寄にはゆっくりの45分無料が嬉しい。木立を眺めながらの温泉はまた格別でした。地酒のサービスもついて、ほろ酔い気分の夕食は旅籠膳。箱根・小田原の地元野菜の旬菜がシェフのオリジナルソースに合い絶品の完食です。お魚、肉料理も少量会席コース、質ともに大満足。良い想い出になりました。　お世話になりましたスタッフの皆様ありがとうございました。また是非利用したい宿です。,2015/9/27
442, 2歳の息子を連れて伺いました。塗り絵やゲーム、スタンプラリー等があり、とても楽しんでいました。その他でも スタッフの方々の心遣いが多々感じられ、素敵な旅行になりました。 朝食だけは、男性には少し少なかったようなので、もう少し量を増やして頂けたら嬉しいです。貸し切り風呂も綺麗で、是非また伺いたいと思いました！,2015/9/24
443,道が混んでいてチェックインが遅れてしまいましたが、夜ご飯も用意してくださりすごく助かりました(>_<)対応もとても良く楽しい時間を過ごせました!!彼の誕生日だったので支払いを彼の前でしたくないことも了承して下さり、チェックアウトの際でなくても大丈夫だった事が有り難かったです。足湯の時間が決まっていて入れなかったのが残念でした、、、。,2015/9/23
444,今回、家族で近場で一泊と思いここを選びました。いろいろな口コミを参考にしましたが行ってみてよかったなというのが印象です。私達もそうですが、とくに中高生の子供達にはお風呂と食事はかなり満足のいくものだった様で、これなら安心してもっと内容をグレードアップしても良かったかなと思いました。食事の対応をしてくれた方達もとても丁寧で好印象でした。館内には無料マッサージチェアーがあって、妻は大変気に入って使っていました。次は違うプランでも行ってみたいと思わせる宿でオススメです。,2015/9/14
445,箱根に初めて行きました。宿はすごく雰囲気があってスタッフの方も気さくで対応がよかったです。温泉も素晴らしく本当に肌がスベスベになりました。ご飯も朝、夕共にとても美味しく大満足でした。ただ、部屋の中と露天風呂付近の匂いが、温泉の匂いかもしれませんが結構きつくてそこがちょっと残念でした。,2015/9/13
446,リピータです。このお宿は五回ぐらい泊まりました。今回の夕食は最高でした。当日で予約したのに、夕食はちゃんと準備してくれました。ありがたいです。このお宿の雰囲気がすごくリラックスできますので、まだ行きたいです。,2015/8/31
447,先日はお世話になりました。週末の旅行でしたが、お手頃な価格で泊まることができて有難かったです。送迎バスを何度もだして頂き、本当に助かりました。宿もとても綺麗で、アメニティも充実していました。ご飯も、少なめのものと書いてありましたが、丁度よくお腹いっぱい食べられました。何よりフロントをはじめ、スタッフの方々がとても親切で、細かい気配りをして頂き居心地がよかったです。また泊まりたい宿です。ありがとうございました。,2015/8/28
448,今回はグレード下の部屋を利用させていただきましたが、値段相応の部屋でした。内装はよかったのですが、景観がよくありませんでした。もう少し値段設定を考慮していただければと思います。まあ今回は1Fだったのでしかたなかったのかな？と。。。B1Fの大浴場は今回すごくぬるかったです。それと朝一髪の毛を洗髪したくてシャワーをひねったのですが最初すごく冷たくってお湯を出し続ける事10分ようやく暖かい湯が出てきました。前回室内の露天風呂がなかなかお湯が出てこなかった経験があったので、またか〜という感じでした。,2015/8/27
449,親子３世代で宿泊しました。自然に囲まれていて早朝の蝉しぐれやうぐいすの鳴き声、たくさんの木々に癒されます。ロビーには子供向けにおもちゃや塗り絵が置いてあり無料のコーヒーを飲みながら遊びました。妖怪ウォッチのスタンプラリーに参加して景品の妖怪ウォッチグッズをいただいて子供たちは大喜び！貸切の露天風呂は源泉掛け流しです。お庭ビューで山の景色などは見えません。大浴場は内風呂のみですが窓が広く朝には日が射して気持ちが良かったです。貴重品を入れるロッカーが無いのであるといいなと思いました。お夕飯ですが、女性向けのコースでしたが私達には十分な量でした。子供のお料理も美味しく煮込みハンバーグが気に入ったようです。無料のマッサージチェアやドクターフィッシュ体験など色々楽しめて予想を上回る良い宿でした。また泊まって次回は紅葉したお庭を散歩してみたいです。,2015/8/26
450,ＨＰの画像と違う部屋(狭い、暗い、景色は見えない)に案内され驚きました。空いていたので替えていただきましたが、両方の部屋が同じ料金ではおかしいです。ＨＰの画像の部屋は最高でした。他の方もコメントされていましたが、この点は直された方が良いと思います。,2015/8/22
451,貸切も内湯も両方良く、ゆっくりできました！人が少なかったのもあるけど。ご飯は朝食は全て食べられました！夕食も美味しかったけど、お米は初めから出てる方が嬉しいです。最後にお米はお腹いっぱいで残してしまいました。,2015/8/16
452,夕食はまだあるの！？と言うくらいボリュームがありました。中でも牛は格別でした。また、伺いたいと思います。,2015/8/16
453,初めての箱根旅行！お部屋の広さはちょうどよくのんびりできました♪しかしお菓子がのったお盆や、ティッシュケースの上など細かいところではありますが、埃が目につきがっかり。窓からの景色も緑がたくさんで、とても気持ちがいいのに窓があまり綺麗ではなく少し残念でした。特選懐石付き、貸切露天風呂が１回無料のコースでの宿泊でしたが、お盆休みということも加味して考えると、お値段がとても良心的でありがたいです！！ちなみに夕ご飯のバーニャカウダがとっても美味しく(他のお料理も)大満足。夜にはケーキバイキングがあり彼氏は大喜びでした(笑)肝心の温泉もとってもきもちよかったです。貸切露天ではのんびりと過ごせましたし、雨よけの傘が置いてあるなど、細かい気配りが好印象！今度は露天がついたお部屋に泊まりたいとおもいます！,2015/8/15
454,間際に決めた宿泊でしたが到着時のチェックインで女性の方が丁寧かつとても気さくな接客対応で良かったです。部屋も広すぎず狭すぎずで音など気にせず過ごせました。ただ、遅い時間に入って早速布団を出して、自分が汗臭いと思ってお風呂に入って部屋に戻っても臭いました。原因は、枕の臭い。干すか洗うかはして欲しいです。フロントに電話したら直ぐに替えて下さいました。シーツなど綺麗にしても残念でした。貸切風呂はとても良かったです。朝食時にトマトときゅうりをお好きに食べられますがナイフを用意するか御飯など下げる方にお切りしますか？と聞いて欲しかったです。,2015/8/4
455,夫婦と子供3人での宿泊でした。部屋は広々としていて、清潔感がありました。タオルもたくさん用意されていて、お風呂に行くカゴもとても便利でした☆料理は少なめのプランでしたが、見た目も味も大変満足な内容でとても美味しかったです！食事処のスタッフさんもとても親切で、きめ細やかな配慮がありがたかったです。温泉もとても良く、古めかしさはありつつも、清潔感があり、ゆったり入れました。貸し切り露天風呂も無料で入れたので、朝日を浴びながら、家族で入れて、最高の気分でした！あと、コーヒーとかが自由に飲めたり、ドクターフィッシュの水槽があったり、ボードゲームや塗り絵、絵本など、細かなサービスも充実していました！是非また訪れたい宿です☆お世話になりました。,2015/7/31
456,緑に囲まれたとても静かな宿で、朝はウグイスの声に癒され、ゆったりとした時間を過ごすことができました。泊まったのは露天風呂付きの部屋で、温泉ではありませんでしたが、檜風呂で水質がやわらかく、檜の香りに包まれ、テラスには椅子もあって快適でした。部屋には化粧水、乳液、クレンジングオイル、洗顔フォームが常備してあり、助かりました。ただ、部屋のカウンターの椅子の座面が小さく、お尻が痛かったので、もう少しゆったりと座れる椅子なら良かったと思います。無料のマッサージチェアが大きな窓に向いて設置されていて、目の前に新緑が広がり、最高の心地良さでした。また泊まりたいと思います。,2015/7/26
457,自然に囲まれて、窓からも緑を感じられて素敵な宿でした☆部屋が思ったより広かったです！ 清潔感もあり、綺麗です！夕食が懐石料理だったのですが、半個室みたいになっていて、ゆったり食べられます。料理も、こだわっていて凄く美味しかったです！貸し切り露天風呂は、夕食前に入りましたが、 湯冷めもしないし、景色も本当に最高でした。また行きたいです！！！ 強羅は、初めてでしたが、楽しめました。,2015/7/21
458,部屋は足が長い椅子じゃなく、ゆっくり出来るものが良かったですが…大満足です。夕食は旦那さんは少ーし物足りなかったようですが、わたしは丁度良く、朝食は本当に十分でした。何よりバーニャカウダが絶品。お土産にバーニャカウダソースを買って帰っちゃいました^_^露天風呂は大雨のせいで入れなかったのですが、お部屋のに入れたので良かったです♪サービスも至れり尽くせり…。是非何度もリピートしたいお宿でした。,2015/7/19
459,キングサイズベッドの部屋でしたがとても広くてキレイでした！マッサージチェアもあったり、着物がたくさんあって大満足です！,2015/7/19
460,今回は彼氏と旅行に来ました。夕・朝食付きのコースで、ご飯はとても美味しかったです。私はお腹いっぱいでしたが、彼には少なめだったようで、夕食後に売店で買ったカップ麺を食べてました（笑）貸切露天風呂も利用しました。木しか見えなかったので景色がとても良いというわけじゃなかったのですが、プライベート空間となってとても良かったです。強羅駅からこちらの宿まではケーブルカーで行くことをお勧めします。行く時に、強羅公園から歩いて行ったのですが、山の上というだけあり、坂が急で大変だったので、、、（笑）ケーブルカーの中強羅駅からはとても近いです。リラックスをしたくて今回の旅行を計画し、とても良い旅になりました。夕食と朝食がついて、貸切露天風呂も利用して1人10000円もしなかったので、お値段的にも満足しています。ぜひまた利用させていただきたいと思います(*^_^*),2015/7/15
461,部屋がとてもきれいで、部屋に露天風呂がついていてこの値段で泊まれるのは最高でした。大きいお風呂の泉質はとても良く、お肌がツルツルになりました。部屋からの箱根の風景は最高で、開放的な空間で日常を忘れることが出来ました。ゆっくり時間が流れているようで、久しぶりにゆっくり出来ました。ありがとうございました。,2015/7/14
462,非常に癒されました。大自然に囲まれていて、雨が降っていましたが雨で緑が活きてとても綺麗でした。また是非行きたいと思います。,2015/7/10
463,お部屋は露天風呂付き、畳敷きにダブルベッドの和モダンな感じで広くないけどきれいでした。夕食少なめのプランということでしたが、女性の私には丁度良く味も美味しかったです。でもグルメなものを求めてる人や男の人には物足りないかも。朝ごはんも美味しかったです。貸し切り露天風呂自体は良かったのですが、脱衣所が狭く、少し古い感じがしてもったいないと感じました。あと脱衣所にエアコンがあればいいと思いました。今回は半額ということで利用しましたが、通常料金3240円は高いと感じました。大浴場は小さかったですが、お湯はすごく気持ちが良かったです。全体的には良かったです。若い人向けの旅館だと思います。係の人はみんな親切でほっとしました。,2015/7/9
464,温泉は2種類の源泉から引き込まれているとの事で、すぐに温まりよかったです。ただ室内の風呂すべてお湯が排出されるまでの時間がかかる為要注意です。外国人のお客様も多いみたいですが、露天風呂等にもう少し翻訳した文書の掲載されたほうがいいかと。。家族連れの外国の方が騒いでおられてせっかくのゆったりまったり気分が半減してしまいました。マナーの違いがあるのはわかりますが、こられる外国人の方も自国ではないのですから、もう少し配慮がと思いました。（愚痴になってすみません）温泉も料理（ごはんがすごくおいしかったです！！）もGOODでした。ありがとうございました。,2015/7/9
466,貸切風呂とご飯が良かったです。ご飯は多すぎず、少なすぎずちょうどいい量でおいしかったです。接客はとても丁寧で親切でした。,2015/6/25
467,以前に一度宿泊し、妻が館内の綺麗さと浴衣が選べる所が気に入り、再度予約しました。記念日に合わせての宿泊だったので、大浴場は利用せず貸切風呂のみ複数回入浴。４つの貸切風呂を重なる事無く、全て違うお風呂に予約してもらえて楽しめました。夕食のボリュームが、やや足りなかったのが残念。しかしロビーにインスタントヌードルやスナック菓子などの販売も有り、コンビニが遠い宿泊場所には助かるサービスでした。また利用したいと思います。,2015/6/24
468,自然に囲まれゆっくりしたいと思い彼女と休暇を合わせ利用させて頂きました。趣きのある入り口があり到着した当初から印象は良かったです。旅館内は落ち着いた雰囲気がありました。平日ということもあり人も少なく(旅館のスタッフも少なかった？)居心地が良かったです。部屋は和室で、トイレも含めとても清潔感があり二人で感激してました。夕食は量は少なめと書いてありましたが個人的には十分な量があり、バーニャカウダーが特に美味しかったです。貸切露天風呂は予約制で特別感があり気持ち良かったです。しかし半額だからこそ利用しましたが、正規料金だと高い気がします。最後に写真を撮って頂きました。スタッフの方が「こちらで撮るお客様もいらっしゃいますよ」と別の場所でもう一枚撮って下さり嬉しかったです。総じてとてもリフレッシュできました。また利用させて頂きたいと思います。,2015/6/21
469,2回目の利用です。子供にスタンプラリーなどあり去年よりも安いプランで予約したのにとても楽しめました。食事も美味しく量も多いくらいに感じとても満足です、スタッフさんも子供に話し掛けてくれたりとても親切にして頂きました。また利用したいです！,2015/6/20
470,今回、初めて泊まらせてもらいました。お食事は夜、朝とにも工夫をされたメニューで楽しみながら食べることができました。男性にはもしかすると、少ない量かもしれませんが、女性には大変満足できる量だと思います。お風呂は小さいサイズですが、二種類のお湯があり楽しむことができました。また、機会があれば是非利用したいです。,2015/5/31
471,見本の写真とは少し違いましたが貸切の露天風呂は良かったです。最終の案内だったのでお時間気にせずゆっくりどうぞと言われのんびり入ることが出来ました。朝食もバランスが良く美味しかったです。また利用したいお宿です。,2015/5/28
472,彼氏の誕生日に利用しました〜事前にケーキなどを注文したら電話でとっても丁寧に対応していただけて良かったです。ちょっと最寄のコンビニまでは距離があるけど笑。周辺にも観光スポットが多くてまた利用したいです。,2015/5/27
473,彼の誕生日のお祝いで、客室露天が付いてる部屋に泊まりました。ベッドも大きく、部屋もおしゃれで過ごしやすかったです。しかし和室なのにカウンターとハイチェアしかなく、小さくても座卓も欲しかったというのが本音です(^_^;)スタッフの方みんな対応が良く、気持ち良く過ごすことができました。夕飯も朝食も大満足で、量もたっぷりお腹いっぱいでケーキ食べるのをかなり遅くにしました。笑また箱根に行った際は利用させていただきたいと思います。,2015/5/25
474,お出迎えして下さったフロントの方の親切な対応、浴衣を選んで写真撮影が出来ることや、お部屋の広さ、キングサイズベッドの快適さ、更にベランダにあるこじんまりとした可愛らしい露天風呂など想像以上に良かったです！（シャワールームの水圧が弱かったことが気になりましたが、ベランダのシャワーの水圧は大丈夫でした）お食事はシンプルですが、ボリューミーで、完食出来ないほど。お部屋に戻ればサプライズのフルーツプレートが！とても嬉しかったです！スタッフの方々全員に良くして頂き、おかげさまで、一ヶ月に一回しか会えない遠距離の彼氏と素敵な思い出が出来ました！ありがとうございました。,2015/4/28
475,お世話になりました。チェックインを済ませて、ドリンクマシンがあったのでいただこうと思いきや、コーヒーの方しかなく、お茶のマシンは断水状態（早朝までそうでした）。浴衣は女性用はもう少し種類があると喜ぶのでは？妻がトイレを探しに行き厠（かわや）の意味が分からなかったらしくウロウロ。まあこれはご愛嬌ですね。和室で自分で布団を敷くスタイルは珍しかったですが、他人の目を気にすることなくくつろげました。洗面台も風呂の外にあり有り難かったです。食事は配膳の方により説明があったりなかったり、隣の方の説明で理解しました。質、量ともほぼ満足でした。泉質はいいのですが、大浴場が大きいともっとくつろげたかな？高級マッサージ器は快適でした。箱根でクリップしたい宿です。,2015/4/28
476,品がありゆったりとした雰囲気で落ち着きました観光地へのアクセスがいいのにとても静かな所でした！お食事の時間が2部制になっているので、大浴場に人が集中せず、ほとんど貸し切り状態でゆっくり入ることができました！また、お湯の温度も丁度よく癒されました。貸し切り風呂は、横一列に仕切られてあるので隣のお風呂の方々が賑やかだと気になりますが、周りの景色を見ながらのお風呂は気持ちがよかったです。お料理の説明も丁寧で綺麗なお料理でお腹いっぱいになりました。プランで写真をカレンダーにして頂いたりデザートを用意して頂きとても充実した時間が過ごせました。ありがとうございました。,2015/4/27
477,妊婦の妻を気遣ってくれてとても温かくしてくれました。(特に配膳係の方に感動しました。)料理は質・量ともに満点で大変満足しました。温泉も気持ちよく日頃の疲れがとれました。子供が産まれたらまた絶対泊まりに行きます！！,2015/4/26
478,お部屋にアリがたくさんいていやな気持ちになりました。でも旅館の人やごはんもおいしかったので☆4つです。,2015/4/24
479,貸切り風呂は予約が必要で、朝夕2回お願いしました。ここのお風呂は肌がすごく艶々になります。時間もあったし、大浴場にも入りました。大浴場はそんなに広くはないです。他のレビューの方が「湯船が汚い」と書いてありましたが、あれは温泉の説明文を読むと「温泉成分の固形物」とありましたよ。食事は夕方コース料理で、おなかかいっぱいで十分でした。部屋はフロントのすぐ隣でしたが、玄関ドアとは別に仕切り戸があるので外の音は聞こえませんでした。お部屋は洋室でとても広く、お風呂がないタイプでトイレは有。唯一この部屋で困った？のはコンセントが少なかったことぐらいです。二階にマッサージチェアがありうれしかったです。食事処はスタッフの方はよく動いてくれるし、そんなに狭くなかった。フロントの女の子も良いホテルでした。また箱根にいくとしたら、ここを利用したいなと思ったくらいです。,2015/4/24
480,客室露天風呂のつもりが部屋を取り間違えたのが失敗だった。大浴場は狭かった。部屋でゆっくりと入る？が主なのでしょうか。部屋は良かったですが隣？なのかドア等の音がバタンバタンとかなり響きました。24hのコーヒー等のドリンクバーは カフェラテのミルクが途中で切れてました。喫煙者で無ければ清潔感等とてもいいと思います。,2015/4/22
